{
  "schema_version": "1.0.0",
  "record_id": "RIGHTS-RC-2026.09.27-01-01",
  "record_status": "approved",
  "release_id": "RC-2026.09.27-01",
  "manifest_hash": {
    "hash_profile": "afwi-content-sha256-v1",
    "content_kind": "text",
    "media_type": "application/json",
    "sha256": "453c7196daddf09af131c853539fe01840521d33a9199735596c86778c758876"
  },
  "content_commit": "a8f5f0ab5bb96411142934c45a2b8ff0f0f9fc2f",
  "decision_date": "2026-09-27",
  "approved_by": "ルール所有者",
  "normative_content_changed": false,
  "previous_rights_record": "RIGHTS-RC-2026.09.26-01-01",
  "decision_evidence": [
    {
      "path": "rule-core/generated/reviews/rights-clearance-publication-owner-review.md",
      "hash": {
        "hash_profile": "afwi-content-sha256-v1",
        "content_kind": "text",
        "media_type": "text/markdown",
        "sha256": "e847898f5e2fdccb19ab41118e88687dc5550768ce947f72a8f6b373a947f26c"
      }
    },
    {
      "path": "rule-core/generated/reviews/rights-clearance-publication-owner-review.json",
      "hash": {
        "hash_profile": "afwi-content-sha256-v1",
        "content_kind": "text",
        "media_type": "application/json",
        "sha256": "93ace89b20a94699438d27f14814cf2418219bf1b514ba933e1263cff4de0fa9"
      }
    },
    {
      "path": "rule-core/generated/reviews/publication-license-owner-review.md",
      "hash": {
        "hash_profile": "afwi-content-sha256-v1",
        "content_kind": "text",
        "media_type": "text/markdown",
        "sha256": "3e9a8159196b7f85c658958071b8a5e3c56c64f409489922ac6405b1f731f5a5"
      }
    },
    {
      "path": "rule-core/generated/reviews/publication-license-owner-review.json",
      "hash": {
        "hash_profile": "afwi-content-sha256-v1",
        "content_kind": "text",
        "media_type": "application/json",
        "sha256": "28ba0bc1da5c0405697fef34ff81f2b115ee0dc05c211454cd3979c735c3a654"
      }
    }
  ],
  "cleared_for_public_distribution": [
    {
      "path": "rule-core/LICENSES.md",
      "artifact_class": "governance",
      "release_manifest_classification": "not-in-frozen-manifest",
      "artifact_hash": {
        "hash_profile": "afwi-content-sha256-v1",
        "content_kind": "text",
        "media_type": "text/markdown",
        "sha256": "beb7b51c31927ff68d454158a16ab7019c26348778986b2e05c5a4ec2b29fde0"
      },
      "clearance_basis": "publication license declaration; owner-approved publication policy for original/normalized Rule Core artifacts",
      "public_distribution_allowed": true,
      "raw_source_included": false,
      "license_reference": "rule-core/LICENSES/CC-BY-SA-4.0.txt"
    },
    {
      "path": "rule-core/LICENSES/CC-BY-SA-4.0.txt",
      "artifact_class": "governance",
      "release_manifest_classification": "not-in-frozen-manifest",
      "artifact_hash": {
        "hash_profile": "afwi-content-sha256-v1",
        "content_kind": "text",
        "media_type": "text/plain",
        "sha256": "7c69f8f21746cfc382d43b94916cb0df6f5183e307c4ef003b2e91f52b3ddd81"
      },
      "clearance_basis": "publication license declaration; owner-approved publication policy for original/normalized Rule Core artifacts",
      "public_distribution_allowed": true,
      "raw_source_included": false,
      "license_reference": "rule-core/LICENSES/CC-BY-SA-4.0.txt"
    },
    {
      "path": "rule-core/LICENSES/MIT.txt",
      "artifact_class": "governance",
      "release_manifest_classification": "not-in-frozen-manifest",
      "artifact_hash": {
        "hash_profile": "afwi-content-sha256-v1",
        "content_kind": "text",
        "media_type": "text/plain",
        "sha256": "a30ca9df2153b2e81cfb4a8c2e192acb8044e24f0ed7bcaa3d807ffd9a381012"
      },
      "clearance_basis": "MIT license notice; owner-approved publication policy for original/normalized Rule Core artifacts",
      "public_distribution_allowed": true,
      "raw_source_included": false,
      "license_reference": "rule-core/LICENSES/MIT.txt"
    },
    {
      "path": "rule-core/NOTICE.md",
      "artifact_class": "governance",
      "release_manifest_classification": "not-in-frozen-manifest",
      "artifact_hash": {
        "hash_profile": "afwi-content-sha256-v1",
        "content_kind": "text",
        "media_type": "text/markdown",
        "sha256": "d9761bb75e8864801bbebb3324961169ae0fa80a0ab6c91ec8cd659cf83a5467"
      },
      "clearance_basis": "publication notice; owner-approved publication policy for original/normalized Rule Core artifacts",
      "public_distribution_allowed": true,
      "raw_source_included": false,
      "license_reference": "rule-core/LICENSES/CC-BY-SA-4.0.txt"
    },
    {
      "path": "rule-core/data/emi-components.yaml",
      "artifact_class": "normative",
      "release_manifest_classification": "rights-pending",
      "artifact_hash": {
        "hash_profile": "afwi-content-sha256-v1",
        "content_kind": "text",
        "media_type": "application/yaml",
        "sha256": "22ba7a2358281c1818b291f64808aef273511f0b976dbefc6d157393977ff775"
      },
      "clearance_basis": "normative Rule Core data; owner-approved publication policy for original/normalized Rule Core artifacts",
      "public_distribution_allowed": true,
      "raw_source_included": false,
      "license_reference": "rule-core/LICENSES/CC-BY-SA-4.0.txt"
    },
    {
      "path": "rule-core/data/enablers.yaml",
      "artifact_class": "normative",
      "release_manifest_classification": "rights-pending",
      "artifact_hash": {
        "hash_profile": "afwi-content-sha256-v1",
        "content_kind": "text",
        "media_type": "application/yaml",
        "sha256": "ba92684465208611b9d5d9a313ddd425c18f0635250dbac985857f1e80cd2116"
      },
      "clearance_basis": "normative Rule Core data; owner-approved publication policy for original/normalized Rule Core artifacts",
      "public_distribution_allowed": true,
      "raw_source_included": false,
      "license_reference": "rule-core/LICENSES/CC-BY-SA-4.0.txt"
    },
    {
      "path": "rule-core/data/geography.yaml",
      "artifact_class": "normative",
      "release_manifest_classification": "rights-pending",
      "artifact_hash": {
        "hash_profile": "afwi-content-sha256-v1",
        "content_kind": "text",
        "media_type": "application/yaml",
        "sha256": "ee4ec63a5d5d183d5862926378e5bff0d2a02bddbe03bf709e6db6b03848b382"
      },
      "clearance_basis": "normative Rule Core data; owner-approved publication policy for original/normalized Rule Core artifacts",
      "public_distribution_allowed": true,
      "raw_source_included": false,
      "license_reference": "rule-core/LICENSES/CC-BY-SA-4.0.txt"
    },
    {
      "path": "rule-core/data/rates.yaml",
      "artifact_class": "normative",
      "release_manifest_classification": "rights-pending",
      "artifact_hash": {
        "hash_profile": "afwi-content-sha256-v1",
        "content_kind": "text",
        "media_type": "application/yaml",
        "sha256": "f041c310a5ca9c34bb3d7b57d2f5d10a18070d16aa357cdd8e577d7ab64838b7"
      },
      "clearance_basis": "normative Rule Core data; owner-approved publication policy for original/normalized Rule Core artifacts",
      "public_distribution_allowed": true,
      "raw_source_included": false,
      "license_reference": "rule-core/LICENSES/CC-BY-SA-4.0.txt"
    },
    {
      "path": "rule-core/data/squadron-activation.yaml",
      "artifact_class": "normative",
      "release_manifest_classification": "rights-pending",
      "artifact_hash": {
        "hash_profile": "afwi-content-sha256-v1",
        "content_kind": "text",
        "media_type": "application/yaml",
        "sha256": "30a3d5ad72ed643fec9df9412d7008c66a666bd71a0665e00a6b9245766d3b32"
      },
      "clearance_basis": "normative Rule Core data; owner-approved publication policy for original/normalized Rule Core artifacts",
      "public_distribution_allowed": true,
      "raw_source_included": false,
      "license_reference": "rule-core/LICENSES/CC-BY-SA-4.0.txt"
    },
    {
      "path": "rule-core/data/squadrons.yaml",
      "artifact_class": "normative",
      "release_manifest_classification": "rights-pending",
      "artifact_hash": {
        "hash_profile": "afwi-content-sha256-v1",
        "content_kind": "text",
        "media_type": "application/yaml",
        "sha256": "a5f9de4e583f553faa7ce79bf70c004ecb5f135d0cb14b094174f1c84bce3676"
      },
      "clearance_basis": "normative Rule Core data; owner-approved publication policy for original/normalized Rule Core artifacts",
      "public_distribution_allowed": true,
      "raw_source_included": false,
      "license_reference": "rule-core/LICENSES/CC-BY-SA-4.0.txt"
    },
    {
      "path": "rule-core/data/state-and-event-ids.yaml",
      "artifact_class": "normative",
      "release_manifest_classification": "rights-pending",
      "artifact_hash": {
        "hash_profile": "afwi-content-sha256-v1",
        "content_kind": "text",
        "media_type": "application/yaml",
        "sha256": "e3eb8044a3615f48c3fcd1da9755918fe333c9aa1d970f845152a970a92d4d50"
      },
      "clearance_basis": "normative Rule Core data; owner-approved publication policy for original/normalized Rule Core artifacts",
      "public_distribution_allowed": true,
      "raw_source_included": false,
      "license_reference": "rule-core/LICENSES/CC-BY-SA-4.0.txt"
    },
    {
      "path": "rule-core/docs/design/AFWI-KAI_Rule_Core_バージョン管理・リリース方針-01.md",
      "artifact_class": "governance",
      "release_manifest_classification": "public",
      "artifact_hash": {
        "hash_profile": "afwi-content-sha256-v1",
        "content_kind": "text",
        "media_type": "text/markdown",
        "sha256": "b8cf907ca153110b66ac7af1d9e6af3e46feb7265be44bcc16b9cf5db05b0953"
      },
      "clearance_basis": "Rule Core release governance; owner-approved publication policy for original/normalized Rule Core artifacts",